{
  "generated_at": "2026-10-24T11:21:10.741845+00:00",
  "method": "Every seeded topic probed: source URL liveness (skipped — offline mode), store corroboration (last_seen <= 7d), velocity tracking (series present; a seed with <3 snapshots but a first snapshot <6h old is warming up, not stale). stale-source = dead URL (GET 404/410), never a timeout or HEAD rejection; timeouts are flaky-warning.",
  "counts": {
    "healthy": 93,
    "stale-source": 0,
    "stale-untracked": 15,
    "flaky-warning": 0,
    "seeds": 108
  },
  "stale": [
    {
      "id": "booktok-romantasy",
      "title": "BookTok and the romantasy boom",
      "verdict": "stale-untracked",
      "reason": "only 2 velocity snapshots over 205.2h — tracking broken"
    },
    {
      "id": "caitlin-clark-effect",
      "title": "The Caitlin Clark effect: the WNBA's surge",
      "verdict": "stale-untracked",
      "reason": "only 2 velocity snapshots over 205.2h — tracking broken"
    },
    {
      "id": "chicken-jockey",
      "title": "Chicken Jockey: the Minecraft Movie theater phenomenon",
      "verdict": "stale-untracked",
      "reason": "only 2 velocity snapshots over 205.2h — tracking broken"
    },
    {
      "id": "dubai-chocolate",
      "title": "Dubai chocolate: the pistachio bar that ate the internet",
      "verdict": "stale-untracked",
      "reason": "only 2 velocity snapshots over 205.2h — tracking broken"
    },
    {
      "id": "fragrance-boom",
      "title": "The fragrance boom: FragranceTok, Arab perfumes, and dupes",
      "verdict": "stale-untracked",
      "reason": "only 2 velocity snapshots over 205.2h — tracking broken"
    },
    {
      "id": "glp1-era",
      "title": "The GLP-1 era: weight loss drugs as culture",
      "verdict": "stale-untracked",
      "reason": "only 2 velocity snapshots over 205.2h — tracking broken"
    },
    {
      "id": "grow-a-garden",
      "title": "Grow a Garden: the Roblox game that broke the record",
      "verdict": "stale-untracked",
      "reason": "only 2 velocity snapshots over 205.2h — tracking broken"
    },
    {
      "id": "hyrox-fitness-racing",
      "title": "HYROX and the fitness racing boom",
      "verdict": "stale-untracked",
      "reason": "only 2 velocity snapshots over 205.2h — tracking broken"
    },
    {
      "id": "jellycat-amuseables",
      "title": "Jellycat Amuseables and the kidult plush economy",
      "verdict": "stale-untracked",
      "reason": "only 2 velocity snapshots over 205.2h — tracking broken"
    },
    {
      "id": "kpop-demon-hunters",
      "title": "KPop Demon Hunters: the animated takeover",
      "verdict": "stale-untracked",
      "reason": "only 2 velocity snapshots over 205.2h — tracking broken"
    },
    {
      "id": "labubu-pop-mart",
      "title": "Labubu and the Pop Mart blind box economy",
      "verdict": "stale-untracked",
      "reason": "only 2 velocity snapshots over 205.2h — tracking broken"
    },
    {
      "id": "matcha-everything",
      "title": "Matcha everything, and the shortage behind it",
      "verdict": "stale-untracked",
      "reason": "only 2 velocity snapshots over 205.2h — tracking broken"
    },
    {
      "id": "prediction-markets",
      "title": "Prediction markets go mainstream",
      "verdict": "stale-untracked",
      "reason": "only 2 velocity snapshots over 205.2h — tracking broken"
    },
    {
      "id": "protein-everything",
      "title": "Protein everything: the protein maxxing era",
      "verdict": "stale-untracked",
      "reason": "only 2 velocity snapshots over 205.2h — tracking broken"
    },
    {
      "id": "switch-2",
      "title": "Nintendo Switch 2: the fastest console launch ever",
      "verdict": "stale-untracked",
      "reason": "only 2 velocity snapshots over 205.2h — tracking broken"
    }
  ],
  "seeds": [
    {
      "id": "2xko-sett",
      "title": "2XKO drops Sett as surprise champion",
      "verification": "single-source",
      "verdict": "healthy",
      "reason": "sources live, corroborated, tracked",
      "sources": [
        {
          "name": "Game8",
          "url": "https://game8.co/articles/latest/this-weeks-gaming-news-roundup-oct-4-to-oct-10",
          "status": "not-probed",
          "note": "--offline mode"
        }
      ],
      "last_seen": "2026-10-11T19:30:00-07:00",
      "last_seen_age_days": 12.37,
      "velocity_snapshots": 22,
      "in_store": true
    },
    {
      "id": "31-days-of-halloween",
      "title": "\"31 Days of Halloween\" numbered series",
      "verification": "single-source",
      "verdict": "healthy",
      "reason": "sources live, corroborated, tracked",
      "sources": [
        {
          "name": "SocialPilot",
          "url": "https://www.socialpilot.co/blog/tiktok-trends",
          "status": "not-probed",
          "note": "--offline mode"
        }
      ],
      "last_seen": "2026-10-11T19:30:00-07:00",
      "last_seen_age_days": 12.37,
      "velocity_snapshots": 19,
      "in_store": true
    },
    {
      "id": "ai-misunderstanding",
      "title": "AI misunderstanding scenarios: comedy skits",
      "verification": "single-source",
      "verdict": "healthy",
      "reason": "sources live, corroborated, tracked",
      "sources": [
        {
          "name": "Anijam",
          "url": "https://www.anijam.ai/blog/tiktok-trends/",
          "status": "not-probed",
          "note": "--offline mode"
        }
      ],
      "last_seen": "2026-10-11T19:30:00-07:00",
      "last_seen_age_days": 12.37,
      "velocity_snapshots": 18,
      "in_store": true
    },
    {
      "id": "ai-roleplay-comedy",
      "title": "AI roleplay comedy",
      "verification": "single-source",
      "verdict": "healthy",
      "reason": "sources live, corroborated, tracked",
      "sources": [
        {
          "name": "Lightreel",
          "url": "https://lightreel.ai/blogs/whats-trending-on-tiktok",
          "status": "not-probed",
          "note": "--offline mode"
        }
      ],
      "last_seen": "2026-10-11T19:30:00-07:00",
      "last_seen_age_days": 12.37,
      "velocity_snapshots": 21,
      "in_store": true
    },
    {
      "id": "aion2-launch",
      "title": "AION 2 launches free-to-play",
      "verification": "single-source",
      "verdict": "healthy",
      "reason": "sources live, corroborated, tracked",
      "sources": [
        {
          "name": "DLCompare",
          "url": "https://www.dlcompare.com/gaming-news/this-week-s-video-game-releases-october-2026-week-41",
          "status": "not-probed",
          "note": "--offline mode"
        }
      ],
      "last_seen": "2026-10-11T19:30:00-07:00",
      "last_seen_age_days": 12.37,
      "velocity_snapshots": 22,
      "in_store": true
    },
    {
      "id": "american-girl-possession",
      "title": "American Girl Doll possession reveal",
      "verification": "single-source",
      "verdict": "healthy",
      "reason": "sources live, corroborated, tracked",
      "sources": [
        {
          "name": "genznewz",
          "url": "https://genznewz.com/october-on-tiktok-halloween-takes-over-your-feed",
          "status": "not-probed",
          "note": "--offline mode"
        }
      ],
      "last_seen": "2026-10-11T19:30:00-07:00",
      "last_seen_age_days": 12.37,
      "velocity_snapshots": 18,
      "in_store": true
    },
    {
      "id": "ancestor-photo-prank",
      "title": "Ancestor Photo Prank",
      "verification": "single-source",
      "verdict": "healthy",
      "reason": "sources live, corroborated, tracked",
      "sources": [
        {
          "name": "genznewz",
          "url": "https://genznewz.com/october-on-tiktok-halloween-takes-over-your-feed",
          "status": "not-probed",
          "note": "--offline mode"
        }
      ],
      "last_seen": "2026-10-11T19:30:00-07:00",
      "last_seen_age_days": 12.37,
      "velocity_snapshots": 18,
      "in_store": true
    },
    {
      "id": "and-i-love-her",
      "title": "Santo & Johnny \"And I Love Her\": dreamy transition bed",
      "verification": "single-source",
      "verdict": "healthy",
      "reason": "sources live, corroborated, tracked",
      "sources": [
        {
          "name": "SocialBee",
          "url": "https://socialbee.com/blog/trending-tiktok-songs/",
          "status": "not-probed",
          "note": "--offline mode"
        }
      ],
      "last_seen": "2026-10-11T19:30:00-07:00",
      "last_seen_age_days": 12.37,
      "velocity_snapshots": 18,
      "in_store": true
    },
    {
      "id": "battlefield-6-gamepass",
      "title": "Battlefield 6 hits Game Pass day one",
      "verification": "verified",
      "verdict": "healthy",
      "reason": "sources live, corroborated, tracked",
      "sources": [
        {
          "name": "TrueAchievements",
          "url": "https://www.trueachievements.com/news/new-xbox-games-october-12",
          "status": "not-probed",
          "note": "--offline mode"
        },
        {
          "name": "CapeTimes",
          "url": "https://capetimes.co.za/technology/gaming/2026-10-10-xbox-game-pass-october-lineup-battlefield-6-new-day-one-drops--spooky-hits/",
          "status": "not-probed",
          "note": "--offline mode"
        }
      ],
      "last_seen": "2026-10-11T19:30:00-07:00",
      "last_seen_age_days": 12.37,
      "velocity_snapshots": 22,
      "in_store": true
    },
    {
      "id": "be-ok",
      "title": "\"Be OK\": happy dance over chaos",
      "verification": "unverified",
      "verdict": "healthy",
      "reason": "sources live, corroborated, tracked",
      "sources": [
        {
          "name": "New Engen (source URL not found on 2026-10-11 re-check)",
          "url": "",
          "status": "not-probed",
          "note": "--offline mode"
        },
        {
          "name": "Later (source URL not found on 2026-10-11 re-check)",
          "url": "",
          "status": "not-probed",
          "note": "--offline mode"